teaching,teaching,coursecontent,coursecontent,examination,Examination,labwork,labwork,library_facilities, library_facilities,extracurricular,extracurricular
0,teacher are punctual but they should also give us the some practical knowledge other than theortical,0,content of courses are average,1,examination pattern is good,-1,"not satisfactory, lab work must include latest technologies",0,library facilities are good but number of books are less,1,extracurricular activities are excellent and provides best platform to students.
1,Good ,-1,Not good,1,Good,1,Good ,-1,Not good ,1,Good 
1,Excellent lectures are delivered by teachers and all teachers are very punctual.,1,All courses material provide very good knowledge in depth .,1,"Exam pattern is up to the mark and the Cgpa depends on the various marks distributions like ca, mte etc which is very nice as compare to other institutions. Paper checking does not depend on length of ques but on the material which is the best part of it.",1,Lab work is properly covered in the labs by the faculty and evaluations help to learn more practical knowledge in depth. ,1,Library facilities are excellent in terms of good techniques that are used over there.,1,Extra curricular activities also help students to divert their mind from their study for some time. University plays an important role in this task.
1,Good,-1,"Content of course is perfectly in line with the teaching philosophy that is being perpetuated here i.e cramming,rote learning.",-1,Again the university tests students of their ability to memorize stuff. Questions should emphasize more on concepts rather than testing brain's cramming storage house.,1,Good,0,"Its the best thing i have seen in this university,albeit the behaviour of library staff is unprofessional at times. They are whimsically rude.",-1,Complete wastage of time. Again this opinion is strictly personal and may not coincide with others.
1,teachers give us all the information required to improve the performance.,1,content of courses improves my knowledge,1,examination pattern is good,1,practical work provides detail knowledge of theoretical work,1,library has huge collection of books from different authors,1,extracurricular activities increases mental and physical abilities
1,Yes,1,content were very nice,1,good,1,good,1,good,1,good
1,good and punctual,1,Good,1,Good,1,Good,1,Hardworking,0,No views
1,It is good,1,This semester university has provide best teachers ,1,I like the question pattern,1,Everything is going fine in lab . learning new things. That is good for us,0,I am satisfied with the facilities but few books are limited of  database distribution ,0,No idea about the extracurricular activities. 
1,Good,-1,Needs some improvement,1,Good,1,Good,-1,Its required some libral in rules,1,Good it provides a great platform
1,Good,-1,Needs some improvement,1,Good,1,Good,-1,Its required some libral in rules,1,Good it provides a great platform
1,It's good when compare with my Btech lectures and teaching activities.,0,Knowledge  and depth of the course  is good but while coming to the material it's not upto the mark.,1,"This university is far better than other university when coming to the exam pattern,marks disturbation and while coming to paper checking no biased corrections equal to all. ",-1,Lab and practical are not upto the mark. The topic which are practiced are almost already done in Btech.,1,Good,1,While coming to extracurriculum activities it's better than any other university which I had come around.
1,Good,0,"Knowledge,depth of course is good but course material are not upto the mark",1,Great,-1,Not upto the mark,1,Good,1,Awesome
1,way of teaching is good,1,course content is knowledgeable ,1,exam pattern is good and good paper checking.,-1,lab improves practical knowledge,1,good library facilities,0,ok
0,"University teaching here is very much dependent upon slides,though it is a easy way of teaching but still leaving some concepts unclear..otherwise interaction with the faculty is good.Lecture delivery sometimes is not upto the mark and punctuality is  fine. ",-1,Content of the courses is good but some courses need improvement. Course material is not upto the mark. ,0,Pattern and procedure of the examination is very good. Paper checking needed to be improved.,0,Sometimes systems at labs are screwed up .Otherwise everything is  at their respected desk.,1,Library facilities are very good. No issues ,1,This university is no1 in terms of extracurricular activities and in encouraging students to participate at their comfort levels. 
1,Good,1,Good,1,Good,1,Good,1,Hardworking,1,Good
1,Good ,1,Very good,1,Excellent ,1,Good,1,Good,1,Good
1,As compared to other colleges and university our university is perfect in all the aspects,-1,Material of the course is not good enough ,1,Good,1,Practical work is fair,1,Excellent,1,Great job
1,Good,-1,sometimes proper course material is not required.,1,Good,1,Good,1,Good,1,excellent
1,Lectures helps in clear our concept,1,Easily available course material with sufficient knowledge gaining,1,Good marks distribution Students can easily check there performance throught the semester,1,Practical and easy learning,1,Good,1,Its give various opportunities and exposure
0,"Talk about punctuality, it's really good but the lecture delivery is somehow not appreciated because every teacher has different style of teaching, so lack of knowledge in terms of subject is there and interaction is also kind of boring. A teacher should be entertaining as well but they are really not. All they want us to be studios and disciplined which is really not the thinking of every student.",1,"The materials or links provided for study purpose is good, clarity in depth of courses but again it differs from teacher to teacher.",0,"Exam pattern and how it is conducted is really seems to be good but it's my first year and when I went to scrutiny for the first time it was not as per my expectations. Teachers have marked the answers as per their choice, they must look for the content rather than the length of answers. So poor paper checking is there.",-1,"The evaluation is again bad for our CA, as one of our faculty is really weird. He gives us remarks on the basis of how we present things in front of it, he never look for the content of our answer, which is really annoying. As he expects us to deliver answer in the way he wants us to do. But how can a person do that, as people do have different mentality and they do explain themselves in different manner, so a teacher must understand that quality of a child and should give him marks on the basis of what they say not what they should say.",0,Again some of the faculties don't know how to behave otherwise it is good.,0,This is really a good thing that events happen in our university regularly but they must be announced early so that every student can prepare themselves for participation because sometimes we get to know about most of the events when they have already been conducted. So announcement must be there.
1,"University is very good at delivering proper lectures,also the interaction with students is descent. Sometimes the teachers lack in terms of punctuality but overall university is giving a good input. ",1,The course notes are very knowledgeable and proper.,1,Descent.,1,Good.,1,Descent.,1,Good.
1,Good,1,Good,1,Excellect,1,Good,1,Good,1,Good
1,Good,1,Good,1,Excellect,1,Good,1,Good,1,Good
1,lecturer are punctual and can interact them easily.,1,content of the courses are update and mostly based on current technology.,1,exam pattern and marks distribution is very well procedure,1,well and good infrastructure and have trending software in lab    ,1,library is very well managed and provide needed facilities to us,1,extracurricular activities held in university are necessary it provides student a platform where they can improve and groom them.
1,Good,-1,Needs some improvement,1,Good,1,Good,-1,Its required some libral in rules,1,Good it provides a great platform
1,Good,1,Good,0,Average,0,Average,1,They are doing there job well,1,Good
0,Punctuality is good. Most of the teachers are not interacting with students .,-1,Teachers are not giving depth of course . They trying to cover there work only .,1,It is statisfactory.,-1,3 hours practical is so long. It should be of 2 hours only ,-1,"Well... all the books are not avilable . If they are in library , books are in less number and strength of student are large.",1,They are really very intersting. All the students enjoys alot and get a chance to showcase there talent
1,Good,1,Good,1,Good,1,Good,1,Good,1,Good
1,nice,1,good,-1,not so good,1,ok ok,-1,all books are not available,1,Awesome
-1,lecture delivery is not so good,1,every thing is fine,1,all good,-1,practicle must be of 2 hours,-1,the system in library usually does not work . so it creates a problem for us to issue the book,1,its good for refreshment 
1,It's good,1,It's appreciable,-1,"Not that much good 
Students are working so hard
But they aren't getting satisfactory result",1,"It's good 
Also depends on teacher's knowledge and student's interest",-1,"Sometimes only book is available for some subjects
And it is reserved",1,"It's appreciable
Students who are having interest in co curricular activities, getting a good platform"
1,"Discipline, punctuality , lecture delivery all are good but hv to do some work for quality of lecture",1,Satisfied,0,All are good except paper checking. It should be improved,1,All good,1,Its very helpful,1,All good
0,"Interaction is very good,accurate supplement material is provided but recommendation of books is very poor,the change of a particular teacher after 3 months or a semester of same subject causes problems",-1,The books that are recommended do not contain appropriate content; leads the students to depend on slides given by teachers. Hence the knowledge remains superficial,1,Overall all these things are the plus point of the university,0,Average ,1,"Awesome, peaceful, relaxing atmosphere",0,Good but lacks audience.....as only participants can see these activities on duty leave basis
1,Perfect,1,Awesome,1,Notbad,-1,Too much lanlb file work,-1,All books are not available,1,Perfect
1,It is really gud,1,It is proper,1,It is very gud,0,Evaluation method is gud.But the content is more to write in file,-1,I think number of books are very less according to the students .Only 2-3 copies are available.,1,All the activities are gud and appropriate for students
0,Very good teaching and management but too much load on student and working hours,1,Courses are very good and useful ,0,Examination pattern is good but marks distribution very confusing,1,excellent,1,good,1,very good
-1,in terms of lecture delivery that is good.in terms of punctuality that is also good but in terms of intraction that is very bad. There are some teachers they donot interact and do not litsn our problms that means they do not coprate.,1,Its good,1,"Exam pattren is good, marks distribution is also good bt paper cheacking is very tight.",1,Its good,1,Thats good,0,"Thats good but the problm is whenever in university the functions like one india, one world are held we are not alowed to go because we have to attend the classes and if we miss the classes we will gona loose the attendence and everyone knows in lpu attendnce is very important. "
1,According to me everything is going well in accordance to interaction.More than enough is served. ,1,Everything is fine. Every thing is taught in depth.Even a single point is elaborated enough to understand. ,1,Everything is fine. ,0,I think electrotherapy practical should be of 2 hours.That's enough I think.Rest is fine.,-1,I think stock is not enough more books are required. ,-1,Chance to go and enjoy should be given.I think it should be off when any activity like One India is there to go and enjoy.Otherwise everything is good. 
0,Very good teaching and management but too much load on student and working hours,1,Courses are very good and useful ,0,Examination pattern is good but marks distribution very confusing,1,excellent,1,good,1,very good
-1,not effective and satisfactory in terms of lecture delivery by all the faculty .,1,content is good enough,1,satisfactory ,-1,lab duration of 3 hours is very long . ,1,very cooperative ,-1,extracurricular activies should be held when there are no classes for the students to attend so that every student can enjoy and participate in the events
1,Good,1,Good,1,Good,0,Average,1,Nice,1,Good
1,Good,1,Good,1,Good,1,Good,1,Good,1,Good
1,Accurate,1,Accurate,1,Very good,1,Good,1,Satisfactory,1,Good
1,It's good,1,Accurate,1,Very good,1,It's good,1,Fine ,1,Good
1,Good,1,Perfect,1,Accurate,1,It's good,1,Fine,1,Good
1,it is good depending on the faculty,1,the material provided is beneficial and provides much knowledge,0,it is neither too good nor too bad,1,lab evaluations are pretty good .they help us a lot.,1,library facilities provided are excellent,1,they are amazing and help to boost our stamina.
1,"maintained punctuality, good lecture delivery",1,fully knowledgeable,1,exam pattern is good and good paper checking.,1,having good material in labs.,1,good facilities,1,increasing confidence
0,average,1,good,1,Excellent ,1,too much good,0,average,0,average
0,average,1,good,1,good,1,good,1,better,1,best
1,good,1,well planned,1,good,0,average,1,excellent,1,good
1,good,1,good,1,good,-1,it is difficult to understand experiment in 1 hour,1,good,1,good
1,good,1,good,1,good,1,good,1,good,1,good
1,good,1,ok,1,good,1,good,-1,some books are not available. So please provide,1,ok
0,average,1,good,1,good,1,good,1,there are doing there job good,1,good
1,good,0,average,1,Excellent ,1,lab work is also good,1,all are hardworking and punctual,0,average
1,"it is quite good , depending on teacher and their experience",1,content is very knowledgable and gives us huge knowledge of every subject,1,"examination pattern, marks, paper checking is good.",1,lab work is quite good,1,Excellent,1,extracurricular activities are good.
1,"it is quite good , depends upon teacher and their experience",1,"content is enough, we donot need more.",-1,"too many examination, we are frustrated",0,lab activities are good but not satisfactory in explaining point of view.,1,library is awesome and rich,0,"good it is, but teachers do not consider the new ones."
1,the way of teaching is good but the time more than enough,0,good quallity content but some teachers donot upload ppts on time,0,too much examinations,1,helps in improving skills,1,they are good,1,it is good
1,good teaching delivery,1,course content is good,0,average,1,lab work is nice.,1,library facility is good,1,extracurrcular activities held in university is good.
1,"good, teacher is delivery the lecture in the best way they can",1,the content of the course is knowledgeable,1,examination including exam pattern is good in some ways.MCQs shouls given to students for the preparation of exams.,1,practical work including evaluations are good so that students can learn about practicals.,1,library facilities are good for students.,1,"super, the extracurricular activities held in university. So that student can show the efforts in other fields."
0,good and qualified teachers but few lacks in interaction with students and fails to describe a topic,0,subjects are appropriate but much depth is required as syllabus includes only basics not the details,-1,the level of examination should be raised. Questions with reasoning must be included,1,laboratory provides us a good knowledge about practicals.,1,very good library facilities. Issuing time of book must be increased,1,good and ample number of extracurricular activities take place
0,average,1,good,1,ok,1,good,1,good,1,good
1,"very good teaching facilities, lecture given are fruitful and teachers are punctual",-1,some courses are irrelevant as they are not related to my stream.,1,fair marking scheme and adaptable pattern,-1,practical work insome labs are not upto the marks,-1,more books should be provided and the issue period should be increased,0,they are good but they should give exposure to more students and not the same.
0,interaction is good but not with mostly male lecturers.punctuality is maintained by everyone but lecture delivery not peak quality.,-1,there are many courses which are irrelevant to the branch. some topics are not covered. There is no proper material for any course,0,pattern of examination is good but paper checking is not at all going in a good way.,0,labs are good but experiments are not very informative,1,very good library facilities. Issuing time of book must be increased,1,excellent
1,all things are good,1,not too bad,-1,there should not be negative marking,-1,the labs are not practically built,0,never went there,0,I donot participate
1,all things are good,1,not too bad,1,all things are good,1,good,1,they are good,0,I donot participate
1,all activties are good,1,course material is perfect,-1,there should not be negative marking,1,practical work is good,-1,book issuing time should be increased for 2 weeks,1,all are enough
1,all activties are good,1,not bad,-1,there should not be negative marking,1,good,1,good,1,all activities are good
1,good,1,good,1,not bad,1,super,1,excellent,1,good
1,All is good. no other university is so serious about the concept of practicals.,1,IP is provided to the students which is very helpful for the students.,1,All is good .,1,This is the best in our university because there is no other university which takes seriously for practical work.,0,Really our library provides very good facilites for students and teachers but fine  system was not good it was directly increased upto 10.This is not a good thing.,1,More than best
1,"lecture delivery depends on teacher's knowledge, punctuality is good",0,depth of course is less on the other hand knowledge and material is good,1,"I like it , i am satisfied all these work",-1,"some time lab is not proper working , some teacher's practical knowledge is less on the other side evaluations is not that much good   ",1,Its good and proper design,1,Its upto mark and very efficiently held in our university
1,Good,1,Good,1,Good,1,Good,1,Good,1,Good
1,way of teaching is average,-1,content does not provide deep knowledge,1,excellent ,1,satisfactory,1,Excellent,1,provides good platform to interested students
-1,not so good,0,average,1,quite good,-1,very poor.no equipments are there,1,good,-1,no comments. Because when you participiate you get reappear or backlog and no time is given for exam preparation
0,average,-1,sometime it is irrelevent with the ongoing courses.,1,good,-1,poor,0,average,-1,"the activities are very good but no time is given to students for participation, so its of no use"
1,good,0,average(in one term there should be only two major subjects based on numerical),-1,very poor,-1,very poor.no equipments are there,1,average,0,average
1,the staff is highly punctual ad interactive and encourage students to participate in the class,0,some of them are very helpful and knowledgeable and some are just formality,1,exam pattern is good and good paper checking but paper checking can be improved,-1,lab practicals and evaluations are below average and need lot of changes and improvements,1,library contains all the books regarding courses and other materials and very cooperative library staff,1,lot of activities and students get exposure in games.
1,"staff and faculty members are always available for interaction, very punctual and delivery of lecture can be improved",0,"very knowledgeable, some subjects do not have dedicated material like books available",1,"exam pattern is good, very well marks distribution and paper checking varies from faculty to faculty.",-1,lab practical work can further be improved so that it can meet industrial standards,1,all the books are easily available and accessable and the limit of book issued need to be increased,1,too many activities are conducted and student get ample amount of opportunities to participate
1,good delivery,1,optimum content,1,all excellent,1,excellent work,1,all are good,1,they are going excellent
1,good,1,good,1,good,1,good,1,good,1,good
1,"our university is good in terms of lecture delivery,interaction and punctuality",1,very good,1,Excellent ,1,good,1,library facilities are good . Every book is available in the library,1,good
1,good,1,good,1,good,1,good,1,good,1,good
1,very good,1,very good,1,good,1,very good,1,very good library facilities. Issuing time of book must be increased,1,excellent
1,good,-1,it is not appropriate,0,marks distribution is good but paper checking is not that well,-1,its hard to find a computer working in lab. Students cannot save data in one single PC,-1,"as per libraries, few books are not available and in computer library there are hardly 5 PCs working",0,not much interested
1,"interaction satisfied, lecture delivery good,punctuality always on time",1,Satisfied knowedgeable and proper course material,1,satisfied,1,good,1,good,1,very good
1,Excellent but it depends upon teacher,1,"Good, but there should be at least one a practical subject in every semester",1,Excellent,-1,"Not good, becouse in lab teachers donot teach us how to work on live projects or how to make a live project. So i have ovserved that whatever teachers have been teachig us in lab that will not usefull in our future life.",1,Excellent,1,Excellent
1,good,1,Yes,1,Good,-1,not good..the timing is too much for labs and syllabus is also so vast.we don't get propr revision,-1,books are less,-1,bcoz of lectures..we don't get time to participate..
1,good,1,good,1,good,1,good,1,good,1,good
1,Good,1,Good,-1,Very Tough,1,Good,1,Excellent,0,Average
1,good,1,good,1,good,1,good,1,excellent,1,good
1,Good,1,Good,1,Excellent,1,Good,1,Good,1,Good
1,Good,1,Good,1,Good,1,Good,1,Good,1,Good
1, very good.,1, good.,1,good.,1,satisfactory.,1,good.,1,good.
1,it is ok,-1,it is not very deep,1,it is good,-1,i hate it,1,i love it,1,very good
-1,some teachers aren't doing their jobs in very well manner,1,course contents are very much relevant to our courses,-1,bad,1,very good,-1,i think library facilities are only for hostelers ,-1,"i also want to participate in that activities but i can't take part in those activities because I'm a day scholar 
"
1,Some of the teachers are not well experienced but they are interactive and helpful and punctual.,0,The course structure is good and follows todays technology. Some subjects portion are too vast and are difficult to cover in 1 sem,0,Examination pattern is good but mcq paper checking marks are not correct sometimes.,-1,Practical work is in interesting but different teachers evaluate in their own way. Some of the teachers in some section  give marks without taking viva and some does not give marks accordingly ,-1,Capacity of library is less compared to size of university.,1,Extracurricular activities are good and provide a  good platform.
0,not all the teachers are teaching well but it's fine,1,good,-1,very strict,1,good,1,library has providing excellent facilities,1,good
1,EXCELLENT,1,GOOD,1,It is a good way in pattern,1,good,1,It will provide us various books to increase our knowledge or to understand the  concept because it is good,1,It is good 
1,"The faculty is good ,interaction between student and teacher is also good",1,content of the course is good ,1,good,1,good,1,good,1,good
-1,not good,-1,syllabus is not in debth,1,good,1,good,1,good,1,good
1,Good,1,Excellent,-1,Not good,1,Good,1,Good,1,Good
1,Good,1,Very good,1,Very good,1,Good,1,Good,1,Excellent
-1,some of our faculty member are not so experienced that's why most of the time we are facing problems subjects like CSE(c++),1,as per the courses all the sub are providing  worth knowledge,-1,as per the exam pattern maths exam always have to be subjective rather than objective.,1,as per the lab evaluation we r satisfied with  it,-1,duration of issuing   books from library should be changed from 1week to 2 week that would be great.,1,that's  great
1,good,1,very good,1,all good,1,good,-1,absolutely fine all books are there but the thing is that the time limit is very less we have to return the book that we have issued  very fast,1,best
1,its to good ,0,i dont know,-1,its very bad thing not sowing answer of mcQ in exam we dont jiged what is rigth and rong where mak mistacvk ,1,lab and practical work are litial good,0,i dont think about ,0,hahahah
1,everything is good ,1,regarding the courses everything is good,1,coming to the examinations it is good,1,good,,very good,1,very good it is a good oppurtunities to many students
-1,"everything is good but when coming to some lectures who dont have a good grip on subject,they dont behave well with students and they dont even teach all the concepts in the subject. ",1,coming to the courses these are very well planned... and it all depends on the lectures.,0,In CA's its in the hands of lectures... while in mte's and ete's its good.,-1,not very good... must be improved.,1,very good.,1,there are many oppertunities for students .. its all upon students about how they utilize them.
1,excellent,1,good,0,i think mid trem should be also subjective ,1,good,1,good,1,excellent
0,"everything was good regarding to university but, some lecturers don't have grip on the subject and lag in the teaching",1,good,1,exam pattern and marks distribution are good,1,very good,1,very good,1,excellent
0,normal,1,good,1,good,-1,bad,1,good,1,good
1,good,1,good,1,very good,1,good,1,good,1,"good
"
1,good,1,upto the mark,1,good,1,good,1,good,0,average
